{
  "$schema": "https://javadbat.github.io/schemas/jb-form/v1.json",
  "schemaVersion": 1,
  "id": "3d46b6a2-ecf8-4684-8f23-0f1e058f056d",
  "metadata": {
    "name": {
      "translations": {
        "en": "Untitled form"
      }
    },
    "createdAt": "2026-07-29T12:00:00.000Z",
    "updatedAt": "2026-07-29T12:00:00.000Z"
  },
  "localization": {
    "defaultLocale": "en",
    "locales": {
      "en": {
        "direction": "ltr"
      }
    }
  },
  "elements": [],
  "theme": null
}
